{
  "profileId": "recruitment-security-argument-v1",
  "scope": "leaf-entry scalar projection of the requested security writer argument only",
  "evidence": {
    "level": "source-listing-reconstruction",
    "profile": "recruitment-security-argument-v1",
    "source": "docs/sources/recruitment-security-argument.json",
    "originalRange": "005C3C11 <= PC < 005C3C24",
    "listedBytesVerified": true,
    "stockOriginalVerified": false,
    "originalExecutableExecuted": false,
    "nativeHelpersReconstructed": false,
    "abiVerified": false,
    "realTraceReachabilityVerified": false,
    "troopWriterRecovered": false,
    "securityWriterRecovered": false,
    "commandIntegrated": false,
    "modLawExemptionIncluded": false
  },
  "source": {
    "repository": "sjn4048/311MemoryResearch",
    "commit": "66e167e40c3440929ec016f3872aefc3486434c1",
    "path": "内存资料/整理/Func-内政02-执行征兵.txt",
    "url": "https://github.com/sjn4048/311MemoryResearch/blob/66e167e40c3440929ec016f3872aefc3486434c1/内存资料/整理/Func-内政02-执行征兵.txt",
    "gitBlobSha1": "3e1767ccafd7d217881119d142e8f4b02cdf88ce",
    "snapshot": "docs/sources/recruitment-security-argument-original.gbk",
    "snapshotEncoding": "GBK",
    "snapshotBytes": 22263,
    "snapshotSha256": "c057b8abab1bd4f58ad902a2e0266f09ec11fc08d8406061885535324c2ada71",
    "utf8Snapshot": "docs/sources/recruitment-security-argument-original.txt",
    "utf8Bytes": 23221,
    "utf8Sha256": "6ef16de7adcece461dad2225bdb8aa84bdac73b2326c0214131e8861c2a071b2",
    "acquisition": "GitHub connector decoded text; reversible GBK re-encoding matches pinned Git blob; not direct EXE extraction"
  },
  "license": {
    "spdx": "Apache-2.0",
    "snapshot": "docs/sources/production-price-LICENSE.txt",
    "sha256": "c71d239df91726fc519c6eb72d318ec65820627232b2f796219e87dcf35d0ab4",
    "url": "https://github.com/sjn4048/311MemoryResearch/blob/66e167e40c3440929ec016f3872aefc3486434c1/LICENSE",
    "attribution": "sjn4048/311MemoryResearch"
  },
  "fullCaller": {
    "start": "005C3A50",
    "endExclusive": "005C3E0B",
    "instructionCount": 316,
    "byteLength": 955,
    "sha256": "69c8186fa9fd7807cd4a0747bcbb5ee6b84a6ee39c8a2735900ded05c3921f2e",
    "directCallSites": 51,
    "indirectCallSites": 1,
    "directBranches": 16,
    "implemented": false
  },
  "leaf": {
    "start": "005C3C11",
    "endExclusive": "005C3C24",
    "instructionCount": 7,
    "byteLength": 19,
    "sha256": "8a537f7ccca746304043e2a71bba02596ea52bd8d968e6d835b4f6f28056d698",
    "bytesHex": "8b4424108d48648bc699f7f9b95c899907f7d8",
    "argumentEndExclusive": "005C3C26",
    "argumentInstructionCount": 9,
    "argumentByteLength": 21,
    "argumentSha256": "6b4afd8e5857db8a562d0d127212f0b28fca91d9e9a9f5d8fe251dc65094bb89",
    "excludedWriterCall": "005C3C26",
    "excludedWriterTarget": "004B3E70",
    "writerExecuted": false
  },
  "excludedMod": {
    "description": "law-skill exemption is a separate modification, not a vanilla option",
    "instructionCount": 16,
    "byteLength": 48,
    "contiguous": false,
    "executedByProduction": false,
    "ranges": [
      {
        "start": "005C3C1D",
        "endExclusive": "005C3C22",
        "instructions": 1,
        "bytes": 5
      },
      {
        "start": "009107CA",
        "endExclusive": "009107DB",
        "instructions": 4,
        "bytes": 17
      },
      {
        "start": "009107B0",
        "endExclusive": "009107CA",
        "instructions": 11,
        "bytes": 26
      }
    ]
  },
  "inputSchema": {
    "type": "object",
    "additionalProperties": false,
    "required": [
      "profile",
      "savedCharmSum",
      "savedTroopReturnU32"
    ],
    "properties": {
      "profile": {
        "const": "recruitment-security-argument-v1"
      },
      "savedCharmSum": {
        "type": "integer",
        "minimum": 0,
        "maximum": 765
      },
      "savedTroopReturnU32": {
        "type": "integer",
        "minimum": 0,
        "maximum": 4294967295
      }
    }
  },
  "inputProvenance": {
    "savedCharmSum": "leaf-entry [ESP+10]; earlier execution scan accumulates three valid charisma AL values before their reward callees, saved at 005C3B7A; not the later quantity scan",
    "savedTroopReturnU32": "leaf-entry ESI; most recent explicit caller definition 005C3BA9 saves 004AE3C0 return EAX, not 005C3610 quantity return; preservation/ABI and actual troop writes unproven"
  },
  "arithmetic": {
    "signedTroopReturn": "signed32(savedTroopReturnU32)",
    "divisor": "savedCharmSum + 100",
    "quotientSigned": "trunc(signedTroopReturn/divisor)",
    "remainderSigned": "signedTroopReturn - quotientSigned*divisor",
    "securityDeltaSigned": "-quotientSigned, canonical positive zero",
    "securityDeltaU32": "securityDeltaSigned modulo 2^32",
    "divisorMin": 100,
    "divisorMax": 865,
    "quotientMin": -21474836,
    "quotientMax": 21474836,
    "deltaMin": -21474836,
    "deltaMax": 21474836,
    "zeroDivisorPossible": false,
    "idivOverflowPossible": false,
    "negOverflowPossible": false
  },
  "nonGoals": [
    "No city security read, clipping, actual loss or before/after state",
    "No character getters, quantity reuse, callbacks or pointers",
    "No troop/security/energy/merit/experience/AP/gold/technique writers",
    "No skill-law MOD, RNG, command, EndTurn, stock, Vanilla or console certification"
  ]
}
